14:58:32.003121 IP SCAD05.scad.psu.137 > 192.168.56.255.137: UDP, length 50
E..N......F...8...8......:.`.G.......... FDEDEBEECACACACACACACACACACACABM.. ..
14:58:32.752931 IP SCAD05.scad.psu.137 > 192.168.56.255.137: UDP, length 50
E..N......F...8...8......:.`.G.......... FDEDEBEECACACACACACACACACACACABM.. ..
14:58:33.222131 IP6 SCAD05.scad.psu.49925 > ff02::1:3.5355: UDP, length 45
`....5.......................................5j..............255.56.168.192.in-add
14:58:33.222280 IP SCAD05.scad.psu.62891 > 224.0.0.252.5355: UDP, length 45
E..I.......r..8..........5...............255.56.168.192.in-addr.arpa.....
14:58:33.502912 IP SCAD05.scad.psu.137 > 192.168.56.255.137: UDP, length 50
E..N......F...8...8......:.`.G.......... FDEDEBEECACACACACACACACACACACABM.. ..
14:58:38.925107 IP SCAD05.scad.psu.137 > 224.0.0.252.137: UDP, length 50
E..N.......k..8..........:.<.L.......... CKAAAAAAAAAAAAAAAAAAAAAAAAAAAAAA..!..
14:58:39.502231 IP SCAD05.scad.psu.138 > 192.168.56.255.138: UDP, length 258
E.........E...8...8......
./...M..8....... FDEDEBEEDADFCACACACACACACACACAAA. FDEDE
14:58:39.502478 arp who-has 169.254.94.26 tell SCAD05.scad.psu
..........'.....8.........^.
14:58:40.425098 IP SCAD05.scad.psu.137 > 224.0.0.252.137: UDP, length 50
E..N.......h..8..........:.,.L.......... CKAAAAAAAAAAAAAAAAAAAAAAAAAAAAAA..!..
14:58:40.466073 arp who-has 169.254.94.26 tell SCAD05.scad.psu
..........'.....8.........^.
14:58:41.465107 arp who-has 169.254.94.26 tell SCAD05.scad.psu
..........'.....8.........^.
14:58:41.925139 IP SCAD05.scad.psu.137 > 224.0.0.252.137: UDP, length 50
E..N.......g..8..........:.,.L.......... CKAAAAAAAAAAAAAAAAAAAAAAAAAAAAAA..!..
14:58:44.508963 arp who-has 169.254.94.26 tell SCAD05.scad.psu
..........'.....8.........^.
14:58:45.465227 arp who-has 169.254.94.26 tell SCAD05.scad.psu
..........'.....8.........^.
14:58:46.465258 arp who-has 169.254.94.26 tell SCAD05.scad.psu
..........'.....8.........^.
14:58:47.011692 IP SCAD05.scad.psu.138 > 192.168.56.255.138: UDP, length 233
E.........F...8...8........y...Q..8....... FDEDEBEEDADFCACACACACACACACACAAA. FDEDE
14:58:47.012021 IP SCAD05.scad.psu.138 > 192.168.56.255.138: UDP, length 233
E.........F...8...8............S..8....... FDEDEBEEDADFCACACACACACACACACAAA. FDEDE
14:58:47.508374 arp who-has 169.254.94.26 tell SCAD05.scad.psu
..........'.....8.........^.
14:58:48.465319 arp who-has 169.254.94.26 tell SCAD05.scad.psu
..........'.....8.........^.
14:58:49.465349 arp who-has 169.254.94.26 tell SCAD05.scad.psu
..........'.....8.........^.
14:58:50.508464 arp who-has 169.254.94.26 tell SCAD05.scad.psu
..........'.....8.........^.
14:58:51.465407 arp who-has 169.254.94.26 tell SCAD05.scad.psu
..........'.....8.........^.
14:58:52.465437 arp who-has 169.254.94.26 tell SCAD05.scad.psu
..........'.....8.........^.
14:58:54.519679 IP SCAD05.scad.psu.138 > 192.168.56.255.138: UDP, length 233
E.........E...8...8........u...U..8....... FDEDEBEEDADFCACACACACACACACACAAA. FDEDE
14:58:54.519710 IP SCAD05.scad.psu.138 > 192.168.56.255.138: UDP, length 233
E.........E...8...8........}...V..8....... FDEDEBEEDADFCACACACACACACACACAAA. FDEDE
14:58:54.519842 arp who-has 169.254.94.26 tell SCAD05.scad.psu
..........'.....8.........^.
14:58:55.465522 arp who-has 169.254.94.26 tell SCAD05.scad.psu
..........'.....8.........^.
14:58:56.465556 arp who-has 169.254.94.26 tell SCAD05.scad.psu
..........'.....8.........^.

